{
  "schema_version": "1.0",
  "identifier": "1m17",
  "source": "pdb",
  "provenance": "experimental",
  "dfg_achelix_distance_A": 9.415,
  "hinge_activation_angle_deg": 61.072,
  "n_pocket_residues_resolved": 85,
  "dfg_call": "DFG-in",
  "dfg_confidence": 0.879,
  "dfg_driver": "dfg_achelix_distance_A",
  "achelix_state": "in",
  "achelix_source": "klifs_annotation",
  "inhibitor_class": "Type I",
  "inhibitor_rationale": "DFG-in active-like pocket engaged by Type I inhibitors",
  "warnings": []
}