{
  "schema_version": "1.0",
  "identifier": "1uwh",
  "source": "pdb",
  "provenance": "experimental",
  "dfg_achelix_distance_A": 12.304,
  "hinge_activation_angle_deg": 60.112,
  "n_pocket_residues_resolved": 85,
  "dfg_call": "DFG-out",
  "dfg_confidence": 0.694,
  "dfg_driver": "dfg_achelix_distance_A",
  "achelix_state": "in",
  "achelix_source": "klifs_annotation",
  "inhibitor_class": "Type II",
  "inhibitor_rationale": "DFG-out exposes the allosteric pocket engaged by Type II inhibitors",
  "warnings": []
}